{
  "passportId": "urn:dpp:component:COMP-2026-001",
  "passportVersion": "1.0.0",
  "subject": {
    "subjectId": "COMP-2026-001",
    "productClass": "serialized_component",
    "productModel": "Drive-Inverter-Gen4",
    "manufacturerId": "BPNL000000000001",
    "manufacturerName": "Example Components GmbH",
    "countryOfManufacture": "DE",
    "manufacturingDate": "2026-01-15",
    "qrCodeUri": "https://dpp.example.org/component/COMP-2026-001"
  },
  "lifecycle": {
    "currentState": "active",
    "stateChangedAt": "2026-01-15T12:00:00Z",
    "isCeased": false,
    "transitions": []
  },
  "accessClasses": [
    {
      "className": "public",
      "description": "Any party following the shared public access policy",
      "readablePaths": ["summary.subjectId", "summary.productClass"],
      "regulationSource": "platform-policy:v1",
      "effectiveFrom": "2027-02-18"
    }
  ],
  "regulationPackIds": ["shared_access_profile"],
  "implementationProfile": "aas_dpp4o",
  "issuedAt": "2026-01-15T12:00:00Z",
  "lastUpdatedAt": "2026-01-15T12:00:00Z"
}
